{
  "id": "ios_loc_pre_commit_check",
  "feature_type": "hook",
  "trigger": "pre_commit",
  "tool_ref": "skill:sync-add-ios-loc",
  "desired_behavior": "validate localization before commit",
  "platform_targets": [
    "claude-code",
    "codex-cli"
  ],
  "constraints": [
    "only_touch_ai_config",
    "preserve_user_existing_config"
  ],
  "metadata": {
    "owner": "super-dev",
    "created_at": "2026-03-02"
  }
}
